{"contractVersion":"1.0","reviewId":"review-de1e68eed5d5338b49ce","timestamp":"2026-10-15T17:32:55.853Z","event":"review-finished","snapshotSha256":"de1e68eed5d5338b49ce963432eadb1f83f9ca94523645c027c2c926c113288b","policyVersion":"5264e608fe2b7a4c7923f76e0e3005ffe4e49168245b49db185751fd2b3bd8c3","scopeCounts":{"included":1,"excluded":0,"binary":0,"generated":0,"oversized":0},"adapters":[{"adapterId":"static-review-harness","adapterType":"harness","version":"1.0"},{"adapterId":"claude-code-v1","adapterType":"model","version":"1.0","providerId":"anthropic-claude-code","modelId":"sonnet"}],"promptVersions":[{"role":"code-quality","version":"27bce1d1c541c20c1d428ac3a4bd26b0431030779fb71aa43fa5e08a6f32106a"},{"role":"security","version":"b0a7cbe7d719df231500d09537618cd4b0ca1bfd3ef6ee4601ee4c70ecb4ad14"},{"role":"performance","version":"420a63cca0f8281775e8c0d000ed60a2048656da3f6eefe49bf3a80ca8e154a2"}],"reviewerStatuses":[{"role":"code-quality","status":"completed"},{"role":"security","status":"completed"},{"role":"performance","status":"completed"}],"findingsCount":0,"validationStatus":"valid","sandboxStatus":"not-requested"}
